{
  "$schema": "http://json-schema.org/draft-07/schema#",
  "$id": "Wallet",
  "title": "Wallet or Agent",
  "type": "object",
  "properties": {
    "$schema": {
      "type": "string",
      "description": "The schema version of the agent JSON entry"
    },
    "name": {
      "type": "string",
      "description": "The name of the agent"
    },
    "urlWebsite": {
      "type": "string",
      "description": "An URL to the website of the agent with more information",
      "format": "uri"
    },
    "logo": {
      "type": "string",
      "description": "The URL to the logo of the agent"
    },
    "company": {
      "type": "string",
      "description": "The name of the company or a community developing the agent"
    },
    "companyUrl": {
      "type": "string",
      "description": "The url to the company website (not the product website)",
      "format": "uri"
    },
    "contact": {
      "type": "string",
      "description": "A link to a contact form or an email address for support requests"
    },
    "openSource": {
      "type": "boolean",
      "description": "The agent source code is available under an open-source license"
    },
    "downloadSource": {
      "type": "string",
      "description": "The URL to the source code, for example a github repository",
      "format": "uri"
    },
    "license": {
      "type": "string",
      "description": "The license(s) of the agent source code."
    },
    "capability": {
      "type": "array",
      "description": "The capabilities supported by the agent",
      "items": {
        "type": "string",
        "enum": ["holder", "issuer", "verifier"]
      }
    },
    "executionEnvironment":  {
      "type": "string",
      "description": "Execution environment of an agent is the place where the agent is intended to be run",
      "enum": ["cloud", "edge"]
    },
    "portability": {
      "type": "boolean",
      "description": "Users can export their data from the agent and import them into another device/system"
    },
    "urlAppStore": {
      "type": "string",
      "description": "Link to the Apple AppStore",
      "format": "uri"
    },
    "urlGooglePlayStore": {
      "type": "string",
      "description": "Link to the Google Play store",
      "format": "uri"
    },
    "urlWebApp": {
      "type": "string",
      "description": "Link to the web app - where the agent can be used with a browser",
      "format": "uri"
    },
    "dependencies": {
      "type": "array",
      "description": "List of dependencies required to run the agent",
      "items": {
        "$comment": "it would help to use an enum here, but this job has to be run by each change so the enum gets updated for a valid test.",
        "type": "string"
      }
    },
    "credentialProfiles": {
      "type": "array",
      "description": "List of supported credential profiles. They entries must be valid credential profiles defined by the Credential Profiles Comparison SIG.",
      "$comment": "All values can be found here: https://openwallet-foundation.github.io/credential-format-comparison-sig/#/",
      "items": {
        "$ref": "../viewer/src/assets/schemas/fields.json#/definitions/Credential-Profile"
      }
    },
    "credentialFormats": {
      "type": "array",
      "description": "List of supported credential formats. They entries must be valid credential formats defined by the Credential Formats Comparison SIG",
      "$comment": "All values can be found here: https://openwallet-foundation.github.io/credential-format-comparison-sig/#/resources/Credential%20Format",
      "items": {
        "$ref": "../viewer/src/assets/schemas/fields.json#/definitions/Credential-Format"
      }
    },
    "signingAlgorithms": {
      "type": "array",
      "description": "List of supported signing algorithms. The entries must be valid algorithms defined by the Credential Formats Comparison SIG.",
      "$comment": "All values can be found here: https://openwallet-foundation.github.io/credential-format-comparison-sig/#/resources/Signing%20Algorithm",
      "items": {
        "$ref": "../viewer/src/assets/schemas/fields.json#/definitions/Signing-Algorithm"
      }
    },
    "statusManagements": {
      "type": "array",
      "description": "List of supported status management methods. The entries must be valid status management methods defined by the Credential Formats Comparison SIG",
      "$comment": "All values can be found here: https://openwallet-foundation.github.io/credential-format-comparison-sig/#/resources/Status%20Algorithm",
      "items": {
        "$ref": "../viewer/src/assets/schemas/fields.json#/definitions/Status-Algorithm"
      }
    },
    "keyManagements": {
      "type": "array",
      "description": "List of supported key management methods. The entries must be valid key management methods defined by the Credential Formats Comparison SIG",
      "$comment": "All values can be found here: https://openwallet-foundation.github.io/credential-format-comparison-sig/#/resources/Key%20Management",
      "items": {
        "$ref": "../viewer/src/assets/schemas/fields.json#/definitions/Key-Management"
      }
    },
    "issuanceProtocols": {
      "type": "array",
      "description": "List of supported issuance protocols. The entries must be valid issuance protocols defined by the Credential Formats Comparison SIG",
      "$comment": "All values can be found here: https://openwallet-foundation.github.io/credential-format-comparison-sig/#/resources/Issuance%20Protocol",
      "items": {
        "$ref": "../viewer/src/assets/schemas/fields.json#/definitions/Issuance-Protocol"
      }
    },
    "presentationProtocols": {
      "type": "array",
      "description": "List of supported presentation protocols. The entries must be valid presentation protocols defined by the Credential Formats Comparison SIG",
      "$comment": "All values can be found here: https://openwallet-foundation.github.io/credential-format-comparison-sig/#/resources/Presentation%20Protocol",
      "items": {
        "$ref": "../viewer/src/assets/schemas/fields.json#/definitions/Presentation-Protocol"
      }
    },
    "trustManagements": {
      "type": "array",
      "description": "List of supported trust management methods. The entries must be valid trust management methods defined by the Credential Formats Comparison SIG",
      "$comment": "All values can be found here: https://openwallet-foundation.github.io/credential-format-comparison-sig/#/resources/Trust%20Management",
      "items": {
        "$ref": "../viewer/src/assets/schemas/fields.json#/definitions/Trust-Management"
      }
    }
  },
  "required": ["capability", "company", "name", "urlWebsite"],
  "additionalProperties": false
}
