{
  "name": "Procivis One Core",
  "logo": "logos/procivis-one-core.png",
  "company": "Procivis AG",
  "companyUrl": "https://www.procivis.ch",
  "executionEnvironment": "edge",
  "openSource": true,
  "license": "Apache-2.0",
  "capability": ["issuer", "verifier", "holder"],
  "portability": true,
  "urlWebsite": "https://www.procivis.ch/",
  "urlWebApp": "https://docs.procivis.ch",
  "downloadSource": "https://github.com/procivis/one-core",
  "credentialProfiles": ["ISO mDL", "JSON-LD VCs with BBS (Holder DID)"],
  "credentialFormats": ["JWT-VC", "JWT", "LDP-VC", "MDOC", "SD-JWT", "SD-JWT VC", "VCDM 1.1", "VCDM 2.0", "x509"],
  "issuanceProtocols": ["OpenID4VCI", "ISO 23220-3"],
  "keyManagements": ["did:jwk", "did:key", "did:web", "pub key in X.509 cert", "cose key", "did:webvh"],
  "presentationProtocols": ["OpenID4VP"],
  "signingAlgorithms": ["BBS+ with public key binding", "ECDSA", "EdDSA", "ML-DSA"],
  "statusManagements": ["Status List 2021"],
  "trustManagements": ["Trusted Lists", "List of Trusted Lists (LoTL)", "List of Trusted Entities (LoTE)"],
  "$schema": "../../schemas/wallet.json"
}
