{
  "capability": ["holder"],
  "company": "Microsoft",
  "credentialFormats": ["JWT-VC"],
  "keyManagements": ["did:web"],
  "logo": "logos/authenticator.png",
  "name": "Authenticator",
  "openSource": false,
  "presentationProtocols": ["OpenID4VP"],
  "$schema": "../../schemas/wallet.json",
  "executionEnvironment": "edge",
  "urlAppStore": "https://go.microsoft.com/fwlink/p/?linkid=2168643&clcid=0x409",
  "urlGooglePlayStore": "https://go.microsoft.com/fwlink/p/?linkid=2168850&clcid=0x409",
  "urlWebsite": "https://www.microsoft.com/en-us/security/mobile-authenticator-app"
}
