{
  "capability": ["issuer", "verifier"],
  "company": "esatus AG",
  "credentialFormats": ["AnonCred"],
  "credentialProfiles": ["AnonCreds with did:indy"],
  "logo": "logos/esatus-wallet.png",
  "name": "SOWL",
  "$schema": "../../schemas/wallet.json",
  "executionEnvironment": "cloud",
  "urlWebsite": "https://esatus.com/en/digital-identity/"
}
