{
  "capability": ["holder"],
  "executionEnvironment":"edge",
  "name": "Anonyome Mobile Wallet",
  "logo": "logos/anonyome.png",
  "company": "Anonyome Labs",
  "companyUrl": "https://www.anonyome.com",
  "urlWebsite": "https://sudoplatform.com/identity-wallet/",
  "openSource": false,
  "license": "",
  "credentialProfiles": ["AnonCreds with did:indy"],
  "credentialFormats": ["AnonCred", "LDP-VC", "VC (1.1)", "SD-JWT-VC", "SD-JWT"],
  "issuanceProtocols": ["Issue Credential v1", "Issue Credential v2", "OpenID4VCI"],
  "keyManagements": ["did:indy", "did:key", "did:peer", "link secrets"],
  "presentationProtocols": ["Present Proof v2", "Present Proof v1.0", "OpenID4VP"],
  "signingAlgorithms": ["BBS+ with public key binding", "CL", "ECDSA", "EdDSA"],
  "statusManagements": ["Indy Revocation"],
  "trustManagements": [],
  "$schema": "../../schemas/wallet.json"
}
