{
  "capability": ["issuer", "holder", "verifier"],
  "company": "Spherity GmbH",
  "credentialFormats": ["LDP-VC"],
  "issuanceProtocols": ["Issue Credential v3"],
  "logo": "logos/spherity-wallet.png",
  "name": "Spherity Wallet",
  "openSource": false,
  "presentationProtocols": ["Presentation Exchange v1"],
  "$schema": "../../schemas/wallet.json",
  "signingAlgorithms": ["BBS+ with public key binding", "ECDSA", "EdDSA", "RSA"],
  "statusManagements": ["Status List 2021"],
  "executionEnvironment":"cloud",
  "urlWebsite": "https://www.spherity.com/enterprise-identity-wallet"
}
