{
  "$schema": "../../schemas/wallet.json",
  "capability": ["issuer", "verifier"],
  "company": "Animo Solutions",
  "contact": "ana@paradym.id",
  "credentialFormats": ["AnonCred", "SD-JWT VC", "MDOC"],
  "issuanceProtocols": ["OpenID4VCI", "Issue Credential v2"],
  "keyManagements": ["did:jwk", "did:key", "did:web", "did:cheqd", "did:webvh"],
  "logo": "logos/paradym-wallet.png",
  "name": "Paradym",
  "openSource": false,
  "presentationProtocols": ["OpenID4VP", "Present Proof v2"],
  "signingAlgorithms": ["EdDSA", "ECDSA"],
  "statusManagements": ["Token Status List (TSL)", "Indy Revocation"],
  "dependencies": ["credo", "sd-jwt-js"],
  "credentialProfiles": ["DIIP", "HAIP", "ISO mDL", "SD-JWT VCs (w/ X.509 for Issuers)", "AnonCreds with did:cheqd", "AnonCreds with did:web"],
  "executionEnvironment": "cloud",
  "trustManagements": ["Trusted Lists", "Verifier knows Issuers", "X.509 certificates"],
  "urlWebsite": "https://paradym.id"
}
