{
  "name": "VC Verifier",
  "logo": "logos/eecc-verifier.png",
  "company": "European EPC Competence Center GmbH",
  "companyUrl": "https://id.eecc.de/products/vc_verifier.html",
  "executionEnvironment": "cloud",
  "openSource": true,
  "downloadSource": "https://github.com/european-epc-competence-center/vc-verifier",
  "license": "AGPL-3.0",
  "capability": ["verifier"],
  "portability": true,
  "urlWebsite": "https://ssi.eecc.de/verifier/",
  "credentialProfiles": [],
  "credentialFormats": ["LDP-VC", "SD-JWT-VC", "SD-JWT"],
  "issuanceProtocols": [],
  "keyManagements": ["did:jwk", "did:key", "did:web"],
  "presentationProtocols": ["OpenID4VP"],
  "signingAlgorithms": ["ECDSA", "EdDSA"],
  "statusManagements": ["Status List 2021"],
  "trustManagements": [],
  "$schema": "../../schemas/wallet.json"
}
