{
  "capability": ["holder"],
  "company": "Meeco Group Pty Ltd",
  "companyUrl": "https://meeco.me/",
  "credentialFormats": ["JWT-VC", "SD-JWT-VC"],
  "credentialProfiles": [
    "EBSI",
    "HAIP",
    "JWT VC Presentation Profile",
    "SD-JWT VCs (w/ X.509 for Issuers)"
  ],
  "issuanceProtocols": ["OpenID4VCI"],
  "presentationProtocols": ["OpenID4VP"],
  "keyManagements": ["did:key", "did:jwk", "raw public keys (jwk)"],
  "license": "Commercial",
  "urlWebsite": "https://meeco.me/",
  "logo": "logos/meeco.png",
  "name": "Meeco Holder Wallet",
  "openSource": false,
  "$schema": "../../schemas/wallet.json",
  "signingAlgorithms": ["EdDSA", "ECDSA"],
  "statusManagements": ["Status List 2021"],
  "trustManagements": ["EBSI Trust Registries", "X.509 certificates"],
  "executionEnvironment":"cloud"
}
