{
  "capability": ["holder"],
  "company": "ESSIF Playground",
  "downloadSource": "https://github.com/majo32/sk-essif-verifier",
  "logo": "logos/essif-wallet.svg",
  "name": "ESSIF Wallet",
  "executionEnvironment": "cloud",
  "urlWebApp": "https://wallet.essif.sk/",
  "urlWebsite": "https://docs.essif.sk/en/home-english/",
  "$schema": "../../schemas/wallet.json"
}
