{
  "name": "DID Controller",
  "logo": "logos/eecc-did-controller.png",
  "company": "European EPC Competence Center GmbH",
  "companyUrl": "https://id.eecc.de/products/did_controller.html",
  "executionEnvironment":"cloud",
  "openSource": false,
  "capability": ["issuer", "holder"],
  "portability": false,
  "urlWebsite": "https://id.eecc.de/products/did_controller.html",
  "credentialProfiles": [],
  "credentialFormats": ["LDP-VC"],
  "issuanceProtocols": ["OpenID4VCI"],
  "keyManagements": ["did:key", "did:web"],
  "presentationProtocols": ["OpenID4VP"],
  "signingAlgorithms": ["ECDSA", "EdDSA"],
  "statusManagements": ["Status List 2021"],
  "trustManagements": ["Verifier knows Issuers"],
  "$schema": "../../schemas/wallet.json"
}
