{
  "capability": ["issuer", "verifier"],
  "company": "Meeco Group Pty Ltd",
  "companyUrl": "https://meeco.me/",
  "credentialFormats": ["JWT-VC", "SD-JWT-VC"],
  "credentialProfiles": [
    "HAIP",
    "JWT VC Presentation Profile",
    "SD-JWT VCs (w/ X.509 for Issuers)"
  ],
  "issuanceProtocols": ["OpenID4VCI"],
  "keyManagements": [
    "did:key",
    "did:jwk",
    "did:web",
    ".well-known/jwt-issuer",
    "pub key in X.509 cert",
    "raw public keys (jwk)"
  ],
  "urlWebsite": "https://meeco.me/",
  "license": "Commercial",
  "logo": "logos/meeco.png",
  "name": "Meeco Organisation Wallet",
  "openSource": false,
  "presentationProtocols": ["OpenID4VP"],
  "$schema": "../../schemas/wallet.json",
  "signingAlgorithms": ["EdDSA", "ECDSA"],
  "statusManagements": ["Status List 2021"],
  "trustManagements": ["X.509 certificates"],
  "executionEnvironment":"cloud"
}
